みちのく民俗村,〒024-0043,岩手県北上市立花14-59,39.2713779,141.1304203,北上市,北上川流域及び東北地方の古民家や歴史的建造物などを展示保存する野外博物館,北上川流域及び東北地方の古民家や歴史的建造物などを展示保存する野外博物館。旧菅野家住宅，仙台藩寺坂御番所，修験道場などのほか，南部曲り家などの民家や川舟小屋，唐臼小屋などがある。また民俗資料館や消防資料館などもある。
諏訪神社,〒028-0041,岩手県久慈市長内町35-98,40.1880804,141.7982144,久慈市,源義経ゆかりの神社,源義経ゆかりの神社。平泉の戦いから逃れた源義経一行は久慈までたどりつき、ここから北海道へ渡るためにみなとを見てまわり手だてを考えていると、そこへ追手の畠山重忠があらわれた。心の中では義経を敬っていた重忠はあたらないようにと祈りながら、義経に向かって矢を放つ。すると、その矢は松の木にあたり、義経は無事北へ落ちのびることができた。畠山重忠は矢が義経にあたらなかったことを感謝して、その矢をご神体として祠を建てた。それが諏訪神社の始まりであるとの言い伝えがある。
男山展望台,〒024-0041,岩手県北上市稲瀬町,39.2417368,141.1214665,北上市,頂上近くまで車で登れるので、手軽に北上平野の展望を楽しむことができます,頂上近くまで車で登れるので、手軽に北上平野の展望を楽しむことができます。頂上には「やすらぎの像」が立ち、奥羽山脈を背景にした北上盆地、そして眼下には北上川と和賀川が合流する大パノラマが一望できます。
胆沢城跡,〒023-0003,岩手県奥州市水沢区佐倉河字宮ノ内地内,39.1631849,141.1298108,奥州市,征夷大将軍坂上田村麻呂が延暦２１年（８０２）に築き、それまで多賀城に置かれていた鎮守府を移す,征夷大将軍坂上田村麻呂が延暦２１年（８０２）に築き、それまで多賀城に置かれていた鎮守府を移す。以来、陸奥における軍事的拠点となる。２００年後，前九年の役が起こったとき、源頼義が鎮守府将軍として入城している。◎坂上田村麻呂（７５８-８１１）平安朝初期の武将。わが国最初の征夷大将軍となり、蝦夷征討に武功を示す。
碁石海岸,〒022-0001,岩手県大船渡市末崎町,38.9999749,141.7133457,大船渡市,大船渡市末崎半島の東南端約6ｋｍの海岸線で背後のアカマツやたくさんの草花が彩りを添えるなど、変化にとんだ岸景勝地である,大船渡市末崎半島の東南端約6ｋｍの海岸線で背後のアカマツやたくさんの草花が彩りを添えるなど、変化にとんだ岸景勝地である。「国の名勝・天然記念物」に指定されているほか、「日本の渚・百選」にも選ばれている。なかでも波の浸食により3つの大きな穴が開いた穴通磯は絶景スポットである。名前の由来は、碁石のような扁平な石（黒色の泥岩による円礫）で構成されている海岸があることによる。
大船渡市立博物館,〒022-0001,岩手県大船渡市末崎町字大浜221-86,38.9889683,141.7416125,大船渡市,名勝碁石海岸の近くにある大船渡市立博物館は、三陸海岸一帯で発掘された土偶や古代の漁具などを展示しながら、大地の成り立ちや古くからの人々の暮らしの様子を伝えています,名勝碁石海岸の近くにある大船渡市立博物館は、三陸海岸一帯で発掘された土偶や古代の漁具などを展示しながら、大地の成り立ちや古くからの人々の暮らしの様子を伝えています。スケッチシートに館内の展示物などの絵を描いて提出すると、その絵は１週間館内に展示された後館長からの手紙と共にあなたのもとへ返送されますので、そのやり取りを通して帰った後も学びを深めることも出来ます。過去の津波に関する資料も展示されておりますので、震災学習の場としても活用できます。
おさかなセンター三陸,〒022-0002,岩手県大船渡市大船渡町字砂子前1-1,39.0422424,141.7221103,大船渡市,店内に入ると、壁に所狭しと掲げられた華やかな大漁旗と大船渡のお祭り囃子、気仙甚句のBGMでお出迎えしてくれるおさかなセンター,店内に入ると、壁に所狭しと掲げられた華やかな大漁旗と大船渡のお祭り囃子、気仙甚句のBGMでお出迎えしてくれるおさかなセンター。大船渡で水揚げされた活きの良い取れたての魚介類と、新鮮さをそのままギュッと詰めた加工品や珍味、そして復興グッズも販売しているお土産選びには最適な施設です。もちろんお買い上げ頂いた商品は宅配便でお届け可能です。漁師のかき小屋やお食事処まんぼう亭もあります。
フレアイランド尾崎岬,〒022-0007,岩手県大船渡市赤崎町字鳥沢188-7,39.0240477,141.7397793,大船渡市,南方には、世界三大漁場に面し、背後には豊かな緑と2500本の椿に囲まれた森林,南方には、世界三大漁場に面し、背後には豊かな緑と2500本の椿に囲まれた森林。対岸は国立公園碁石海岸の眺めが広がり、海と森が一度に満喫できるのが、ここフレアイランド尾崎岬です。簡単にバーベキューが楽しめるバーベキューハウスがあり、鍋やまな板もレンタルでき、３日前に予約すれば食材の注文も可能です。宿泊施設には木造ハンガローと和風コテージがあり、天体観測やバードウォッチングなどのアウトドアにも最適です。そして記の温かみを生かした遊具施設も充実しており、アウトドア初心者からお子様まで安心して利用できます。他にもさまざまな用途に合わせて楽しめる多目的ホール、ミーティングや研修に使えるコミュニティースペースも完備しています。
光原社,〒020-0063,岩手県盛岡市材木町2-18,39.7060715,141.1380685,盛岡市,木の香漂う明るいクラフトの店,木の香漂う明るいクラフトの店。すてきなデザインの小物類が多く，味のクラフトも人気。
永祥院,〒020-0063,岩手県盛岡市材木町4-10,39.7068436,141.1387073,盛岡市,境内に、清水観世音をまつる観音堂や、酒買地蔵の伝説などで有名な酒買地蔵堂がある,境内に、清水観世音をまつる観音堂や、酒買地蔵の伝説などで有名な酒買地蔵堂がある。※酒買地蔵伝説※昔、材木町のある酒屋に毎晩酒を買いにくる物言わぬ小僧がおりました。ある晩のこと、 貸した小樽を返さぬことに腹を立てた番頭は、小僧の頭を木槌でなぐってしまいました。 けれども、帰って行く小僧の身を案じた酒屋の主人は、そっとあとをつけました。ところが永祥院（えいしょういん）のお堂の前まで来ると、小僧の姿が見あたりません。 不思議に思ってお堂の中をのぞいてみると、何と貸した小樽が山のようになっています。 ふとお地蔵さんを見上げると、その眉間に傷がついているではありませんか。 そのとき、酒屋の耳に「お客様には親切にしておあげなさい」と鈴のような声がきこえました。 「もったいないことをした、毎晩このお地蔵様が化身されてお酒を買いに来られたのだ」 と酒屋は心から悔やみました。その後、酒屋は親切第一に商売に励み、 縁日にはお地蔵様にお酒を供えて商売繁盛の守り本尊としておまつりをしました。 するとお店は大繁盛、健康と賢い子宝にも恵まれました。
岩手県営スケート場,〒020-0122,岩手県盛岡市みたけ5-9-1,39.7406675,141.1122642,盛岡市,すべての基本情報を見る
,すべての基本情報を見る
盛岡ハイランドカントリークラブ,〒020-0054,岩手県盛岡市猪去釈迦堂44-3,39.6748538,141.0750556,盛岡市,すべての基本情報を見る
,すべての基本情報を見る
啄木新婚の家,〒020-0021,岩手県盛岡市中央通三丁目17-18,39.7062965,141.1414821,盛岡市,明治38年5月、処女詩集「あこがれ」を出版した石川啄木は、 東京で新婚生活をもつという生活設計を変更して、市内の新山小路（現在の中央通3丁目）に帰り、 年来の恋人堀合節子と結婚式を挙げました,明治38年5月、処女詩集「あこがれ」を出版した石川啄木は、 東京で新婚生活をもつという生活設計を変更して、市内の新山小路（現在の中央通3丁目）に帰り、 年来の恋人堀合節子と結婚式を挙げました。しかし、父母と妹が同居する新婚生活は窮迫し、そこでの生活はわずか3週間。 同7月に市内の加賀野磧町（現在の加賀野１丁目）に移り住みます。その時の様子は随筆「我が四畳半」に描かれています。 かやぶきの屋根など当時と変わったところもありますが、ほぼ当時のまま現存しています。 啄木の書や写真なども展示されています。
円光寺,〒020-0874,岩手県盛岡市南大通3-11-49,39.6925041,141.1545591,盛岡市,盛岡に生まれ、内閣総理大臣、海軍大臣をつとめた米内光政が眠っている,盛岡に生まれ、内閣総理大臣、海軍大臣をつとめた米内光政が眠っている。本堂は市指定保存建築物に指定されている。また、元禄５年（１６９２年）に植栽された、盛岡市指定天然記念樹の夫婦(めおと)桂樹がある。
志波城古代公園,〒020-0855,岩手県盛岡市上鹿妻五兵衛新田48-1,39.6808152,141.1083553,盛岡市,平安時代初め（803年）に築城された志波城跡の外郭南門や築地塀を復元して公開しています,平安時代初め（803年）に築城された志波城跡の外郭南門や築地塀を復元して公開しています。歴史上中央政府が築いた日本最北の城は古代の志波城といわれています。盛岡が日本北限の築城の地に選ばれたのは、当時米作の北限が盛岡だと考えられていたからだと思われます。志波城跡の南辺に約1200年前に築城されたときの姿が復元され、中央に配した南門は間口15メートル、奥行き6メートル、高さ11.1メートルあり、平城宮跡朱雀門（奈良市）に次ぐ大規模な門です。その両側それぞれ126 メートルに土を層状に固めた築地塀をめぐらしており、塀の上には櫓（やぐら）を組んでいます。
志波城跡,〒020-0855,岩手県盛岡市上鹿妻五兵衛新田48-1,39.6808152,141.1083553,盛岡市,陸奥国最北端の古代城柵,陸奥国最北端の古代城柵。志波城跡の南辺に約1200年前に築城された時の姿が復元され、中央に配した南門は門口15m、奥行6m、高さ11.1mあり、平城宮跡朱雀門に次ぐ大規模な門。その両側それぞれ126mに土を層状に固めた築地堀をめぐらしており、堀の上にはやぐらを組んでいる。
愛宕山記念公園,〒020-0013,岩手県盛岡市愛宕山1-1,39.7132206,141.1605503,盛岡市,市街地に隣接する愛宕山に、平成５年皇太子殿下の御成婚記念として整備,市街地に隣接する愛宕山に、平成５年皇太子殿下の御成婚記念として整備。市内を見渡す展望台は夜景スポットとしても有名で、そこを中心としたメイン広場には妃殿下雅子様ゆかりの「ハマナス」三輪が描かれている。また公園内の自然散策路沿いには、盛岡ゆかりの歌人、立原道造、武島繁太郎の歌碑が並ぶ。
大慈寺,〒020-0828,岩手県盛岡市大慈寺町5-6,39.6937485,141.1577004,盛岡市,"寛文１３年（１６７３）の創建,"寛文１３年（１６７３）の創建。明治１７年の大火で焼失したが、平民宰相・原敬の寄進建立で現在に至る。 大慈寺の境内には、大正１１年東京駅で一青年の凶刃に倒れた原敬が、その遺言により眠っている。　また、盛岡ならではの送り盆行事「舟っこ流し」発祥の寺院。　大慈寺では「普茶料理」と呼ばれる山草野菜を材料とした素朴な精進料理（中国風の素朴な味は見た目にたいへん美しく、先人から授かった医食同源の知恵を継承）を食することも可能だが、 その場合は事前予約（12名以上70名位まで、1人7
永泉寺,〒020-0828,岩手県盛岡市大慈寺町8-22,39.693293,141.1593059,盛岡市,左甚五郎の作と伝えられている木像七福神はじめ多くの文化財を有する,左甚五郎の作と伝えられている木像七福神はじめ多くの文化財を有する。※滝ノ上観音縁起：旧中野村に白滝という場所があり、最近まで幅2メートル、高さ数メートルの滝があった。昔ここに観音様が祀られていた。あるとき、付近に山火事が発生し危うく類焼しそうになった。観音様は自ら難を逃れて永泉寺に飛んでこられたと伝えられる。それ以来、当寺に祀られ、滝ノ上観音と崇められ盛岡三十三番札所の七番として信仰を集めている。
久昌寺,〒020-0828,岩手県盛岡市大慈寺町1-5,39.695676,141.1572949,盛岡市,寺のシンボルである山門は、総ケヤキ造り,寺のシンボルである山門は、総ケヤキ造り。昭和８年の落成で屋根を支える垂木が放射状に伸び見事な反りを描く「扇垂木造り」が特色。山門の周囲には獅子頭、昇り竜など数々の彫刻がはめ込まれ、１つひとつにいわれがあるという。なお、本堂前にあるシダレカツラは、盛岡市大ヶ生の瀧源寺にある天然記念物シダレカツラより分かれたものといわれている。
岩手大学ミュージアム,〒020-0066,岩手県盛岡市上田三丁目18-8,39.714304,141.1391987,盛岡市,ミュージアム本館、農業教育資料館、獣医学科標本室、植物園、自然観察園があり、これまでの研究業績等をはじめ、宮沢賢治ゆかりの資料の見学もできる,ミュージアム本館、農業教育資料館、獣医学科標本室、植物園、自然観察園があり、これまでの研究業績等をはじめ、宮沢賢治ゆかりの資料の見学もできる。解説ボランティアの説明をうけながらの見学も可能。農業教育資料館は国の重要文化財の指定を受けている。※獣医学科標本室の開設ボランティアによる説明は要予約。
榊山稲荷神社,〒020-0061,岩手県盛岡市北山2-12-12,39.7188315,141.1520835,盛岡市,盛岡の街づくりが始まった慶長２年に、榊山稲荷大明神を盛岡の守護神として城内に祀ったことから始まります,盛岡の街づくりが始まった慶長２年に、榊山稲荷大明神を盛岡の守護神として城内に祀ったことから始まります。藩政時代は、藩主から一般庶民にいたるまで篤く信仰され、「もりおか開運神社」と称され崇められました。その後、明治維新の改革により廃社となったものを、昭和の初めに再興され今では社殿・社務所・参集殿はもとより、盛岡藩時代から由縁のある名勝庭園「緑風苑」を有し、境内は壮厳あふれる神域を醸し出しています。
日高神社,〒023-0808,岩手県奥州市水沢区日高小路13,39.1430231,141.1327389,奥州市,弘仁元年の創建と伝えられる古社,弘仁元年の創建と伝えられる古社。日高火防祭にまつわる神社として有名。予約不要。
釜淵の滝,〒025-0304,岩手県花巻市湯本,39.4505334,141.0712647,花巻市,花巻温泉の近く,花巻温泉の近く。台川の大岩盤を滑る滝。平成17年3月2日付で、国指定名勝「イーハトーブ風景地」の一つに指定された。
滴生舎,〒028-6941,岩手県二戸市浄法寺町御山字中前田23-6,40.1973233,141.1794677,二戸市,国産漆の約80％を生産する二戸市浄法寺町,国産漆の約80％を生産する二戸市浄法寺町。「浄法寺漆」は中尊寺金色堂、日光東照宮や金閣寺など国宝や重要文化財の修復に利用されています。　　その良質な「浄法寺漆」を使った漆器や漆工芸品の展示や漆器の修理を行っております。　　展示販売している隣には、工房があり作業を見学できるほか、漆絵付け体験教室も行っています。
越喜来浪板海水浴場,〒022-0101,岩手県大船渡市三陸町越喜来字浪板,39.1153977,141.8204294,大船渡市,波が穏やかで、小さなお子さんも安心の越喜来浪板（おきらいなみいた）海水浴場,波が穏やかで、小さなお子さんも安心の越喜来浪板（おきらいなみいた）海水浴場。海水の透明度もピカイチで、潜ったり泳いだりいっぱいはしゃいじゃってもOK!
望洋平キャンプ場,〒029-1201,岩手県一関市室根町折壁字室根山,38.9718982,141.4480722,一関市,室根山の8合目にあり、テントサイトから太平洋気仙沼湾が一望できる,室根山の8合目にあり、テントサイトから太平洋気仙沼湾が一望できる。夜は海上に漁火を見ることもできる。室根山頂までは歩いて15分の距離にあり、山頂からの眺望は360度の大パノラマが楽しめる。フリーサイト、オートテントサイトのほかバンガローもある。
室根神社,〒029-1201,岩手県一関市室根町折壁字室根山,38.9718982,141.4480722,一関市,本宮と新宮の２社がある,本宮と新宮の２社がある。本宮は１２９５余年前の養老２年に元正天王の勅令を奉じ鎮守府将軍大野東人が、蝦夷降伏の祈願所として紀州本宮村の熊野権現を勧請したものである。一方、新宮は約６８０余年前の正和２年に陸奥の守護職葛西清信が奥７郡いわゆる磐井・江刺・胆沢・気仙・本吉・登米・牡鹿の鎮守として、紀州新宮村から熊野神宮の神霊を勧請したものだ。東北三大荒祭の一つといわれる室根神社特別大祭が旧暦閏年の翌年に開催される。
産直山ちゃん,〒029-0711,岩手県一関市大東町大原字金山沢22-1,39.015423,141.4197869,一関市,一関市と陸前高田市を結ぶ国道343号線沿いにある、産直施設です,一関市と陸前高田市を結ぶ国道343号線沿いにある、産直施設です。地元産の野菜や果物の他、工芸品などを販売しています。また、季節ごとに収穫祭なとさまざまなイベントを開催しています。
きらら室根山天文台,〒029-1201,岩手県一関市室根町折壁字室根山,38.9718982,141.4480722,一関市,室根山展望休憩所の屋上に設置された天体ドーム,室根山展望休憩所の屋上に設置された天体ドーム。口径50cmの反射式望遠鏡と15cmの屈折式サブ望遠鏡により壮大な天体の世界が楽しめる。また、ミニプラネタリウムや９大惑星模型、天体パネル展示などもある。
千厩アイスアリーナ,〒029-0803,岩手県一関市千厩町千厩字上駒場360番地14 千厩アイスアリーナ,38.9246984,141.3604649,一関市,すべての基本情報を見る
,すべての基本情報を見る
ニコニコパーク,〒029-3404,岩手県一関市藤沢町徳田字大望沢,38.8575265,141.3604411,一関市,健康スポーツ公園
,健康スポーツ公園
産直来夢くん,〒023-0841,岩手県奥州市水沢区真城字杉の下５１,39.1144769,141.1511353,奥州市,東北最大級の産直施設、地元の新鮮野菜、生鮮食品、精肉、工芸品などの販売,東北最大級の産直施設、地元の新鮮野菜、生鮮食品、精肉、工芸品などの販売。広い敷地には新鮮な農産物や魚介類などが販売される直売所と地元食材を使ったメニューが楽しめるレストラン棟があります。
お物見公園,〒029-4206,岩手県奥州市前沢区陣場,39.050952,141.1183241,奥州市,前沢城主の城跡、桜の名所
,前沢城主の城跡、桜の名所
萬鉄五郎記念美術館,〒028-0114,岩手県花巻市東和町土沢5-135,39.3872087,141.2315661,花巻市,日本洋画壇の先駆者萬鉄五郎の絵画・遺品等の展示,日本洋画壇の先駆者萬鉄五郎の絵画・遺品等の展示。土沢城跡に建つ。
旧小原家住宅,〒028-0122,岩手県花巻市東和町谷内6-37,39.3493195,141.2723866,花巻市,建物は寄棟造,建物は寄棟造。茅葺の曲がり家で，曲がり家が発生したと思われる時期に建てられた住宅として貴重なもの。
盛岡南ゴルフ倶楽部,〒028-3121,岩手県花巻市石鳥谷町戸塚2-13-1,39.4746471,141.1897135,花巻市,すべての基本情報を見る
,すべての基本情報を見る
早池峰神社,〒028-3201,岩手県花巻市大迫町内川目1-1,39.5322052,141.4167034,花巻市,盛岡藩の東の鎮山とされた早池峰山の祈願所として、岳妙泉寺が整備されました,盛岡藩の東の鎮山とされた早池峰山の祈願所として、岳妙泉寺が整備されました。慶長15年（1610）から３年をかけて、岳妙泉寺の奥宮として造営されたのが新山堂（現・早池峰神社）です。慶長以後２度ほど修復されましたが、内陣柱を中心とした軸組や、軒回りの彫刻・装飾などにも慶長期の堅実な手法が残されています。
薬師岳,〒028-0501,岩手県遠野市,39.3278378,141.5333031,遠野市,早池峰山南方にそびえ山頂はハイマツとシャクナゲが群生する,早池峰山南方にそびえ山頂はハイマツとシャクナゲが群生する。
早池峰山,〒028-3201,岩手県花巻市大迫町内川目,39.4994461,141.3238952,花巻市,"標高1,"標高1
国立岩手山青少年交流の家,〒020-0601,岩手県滝沢市後２９２,39.8260985,141.088059,滝沢市,"〈山・雪・みちのく　岩手山〉秀峰岩手山の自然豊かな山裾に位置する国立岩手山青少年交流の家(愛称：テンパーク)は,"〈山・雪・みちのく　岩手山〉秀峰岩手山の自然豊かな山裾に位置する国立岩手山青少年交流の家(愛称：テンパーク)は
メイプルカントリークラブ,〒020-0171,岩手県滝沢市大沢1-1,39.7529916,141.0444526,滝沢市,すべての基本情報を見る
,すべての基本情報を見る
南部富士カントリークラブ,〒028-7111,岩手県八幡平市大更47-34-2,39.9123318,141.1630406,八幡平市,すべての基本情報を見る
,すべての基本情報を見る
二戸市シビックセンター,〒028-6103,岩手県二戸市石切所字荷渡6-2,40.2659553,141.2918405,二戸市,市の情報発信基地となる地域情報センター,市の情報発信基地となる地域情報センター。　「福田繁雄デザイン館」はグラフィックデザイナーであった福田氏のグラフィックアート、立体オブジェ、ポスターなどが展示される日本で唯一の常設展示場です。　「田中舘愛橘記念科学館」は、田中舘博士が携わった実験装置や科学的に工作する体験工房のほか、遺品やローマ字の遺墨を展示、博士の生涯や業績を映像で紹介してくれます。
奥州市伝統産業会館,〒023-0104,岩手県奥州市水沢区羽田町駅前1丁目109,39.14443139999999,141.1878284,奥州市,鋳物製品の製造工程を再現展示、鋳物工芸家の秀作等を展示
,鋳物製品の製造工程を再現展示、鋳物工芸家の秀作等を展示
石応禅寺,〒026-0022,岩手県釜石市大只越町1-1-1,39.2765905,141.8802055,釜石市,曹洞宗の名刹,曹洞宗の名刹。「徳治の古碑」や供養石で知られる。
薬師公園,〒026-0024,岩手県釜石市大町,39.2740241,141.8810333,釜石市,平和女神像，市街と海が一望,平和女神像，市街と海が一望。桜の名所としても知られ、例年4月には薬師公園桜まつりが開催される。
川の駅よこた,〒029-2202,岩手県陸前高田市横田町字砂子田169,39.0759591,141.5795636,陸前高田市,都市と農村との交流を目的とした施設で、交流室や地場産品直売所、食堂が設置されている,都市と農村との交流を目的とした施設で、交流室や地場産品直売所、食堂が設置されている。
普門寺,〒029-2206,岩手県陸前高田市米崎町字地竹沢181,39.0262646,141.6569028,陸前高田市,曹洞宗の古刹,曹洞宗の古刹。ツツジの咲く頃は見事。三重塔、大仏像あり。奥州33観音29番札所。被災松を使用した親子地蔵を安置。
