室根山参道,〒029-1201　岩手県一関市室根町折壁字室根山観光,ふもとから室根神社に通じ、登山道になっている。通称鳩胸という急勾配な所あり。旧暦閏年の翌年に開催される室根神社特別大祭では、２社の神輿が参道を下り先着を争う。
室根山展望台,〒029-1201　岩手県一関市室根町折壁字室根山観光,"室根山(895.4m)の山頂付近にあり、太平洋気仙沼湾などが見渡せます。5月下旬から6月上旬にかけて、約20万本のヤマツツジが室根山頂を真っ赤に染め、パラグライダーが目の前から飛び立ちます。2,3階は口径50cmの反射望遠鏡を備える「きらら室根山天文台」になっています。"
室根山のツツジ,〒029-1201　岩手県一関市室根町折壁字室根山観光,室根山山頂を真っ赤に染める約20万本ともいわれるヤマツツジ、レンゲツツジの群落。
姫滝,〒029-1201　岩手県一関市室根町折壁字室根山観光,「山腹の瀑巾高さ十尋、疑うらく、是れ銀河空林に懸り昌珠撩乱岩を砕く」千葉需翁の一節。
室根高原,〒029-1201　岩手県一関市室根町折壁室根山観光,桜、つつじ、すずらん、キャンプ、紅葉と大自然の中で楽しめる国民休養地。県立自然公園。高原牧場あり。
唐梅館山環境保全林遊歩道,〒029-0302　岩手県一関市東山町長坂観光,赤杉の自然林内の歩道と散策しながら，自然観察と森林浴が楽しめる。
唐梅館総合公園,〒029-0302　岩手県一関市東山町長坂字西本町212-1観光,すべての基本情報を見る
菅公夫人の墓,〒029-0301　岩手県一関市東山町田河津竹沢観光,延喜元年菅原道真公夫人は胆沢郡に流され，同６年９月４２才で逝去した。墓は東山町田河津にあり，石碑１基，五輪塔２基が現存している。
宮沢賢治の碑,〒029-0302　岩手県一関市東山町長坂西本町（新山公園内）観光,賢治は死の２年前この地の東北砕石工場に技師として招かれた。地元の青年有志によって建立された碑には「農民芸術概論綱要」の一節が刻まれている。
二十五菩薩堂,〒029-0303　岩手県一関市東山町松川字町裏ノ上観光,阿弥陀如来立像の一木造りの十一面観音像など安置。
猊鼻渓の藤,〒029-0302　岩手県一関市長坂字町467観光,巨大な奇岩怪石の連なる景勝の地で日本百景のひとつである。岩にはそれぞれ名前がついている。フジ岩は太いフジのつるが岩肌にしっかりからみつき，花の盛りには岩全体が鮮やかな紫色に染まる。川下りの舟の中から見上げることができる。
熊谷美術館,〒029-0803　岩手県一関市千厩町千厩字町143番地観光,路地を入った閑静な場所に建つ築約１２０年の土蔵が熊谷美術館。目にまぶしい白壁と重厚な佇まいに洋画家熊谷登久平（千厩町出身）の作品が一層際だちます。
千厩アイスアリーナ,〒029-0803　岩手県一関市千厩町千厩字上駒場360番地14 千厩アイスアリーナ観光,すべての基本情報を見る
黄金山キャンプ場,〒029-0802　岩手県一関市千厩町小梨字新地地内観光,奥州藤原氏の栄華を支えた金の産出地だったと伝えられる黄金山の八合目に位置するキャンプ場。峠から眺める夜景は、千厩の街並みと太平洋の漁火の輝きのコントラストが絶品です。
飛ケ森キャンプ場,〒029-1111　岩手県一関市千厩町奥玉字飛ケ森11-80観光,室根山のすそ野に位置する自然豊かなキャンプ場。春は桜やつつじ、夏にはキャンプやピクニック、秋にはキノコ狩りやいもの子会などが楽しめます。
菅秀才精霊塔,〒029-0804　岩手県一関市千厩町磐清水字松森15番地観光,福寿山安楽寺は、学問の神様といわれた菅原道真の四男・秀才（淳茂）が父母を供養するために建てたと伝えられています。境内には、菅公夫妻と菅秀才を弔う精霊塔と菅公を祀る石祀が残されています。
飛ケ森森林公園,〒029-1111　岩手県一関市千厩町奥玉字飛ヶ森11-183観光,展望台からは栗駒山や焼石岳、奥羽山系を遠くに一望できます。
大光寺薬師堂,〒029-0803　岩手県一関市千厩町千厩字宮敷89番地観光,大光寺に祀られる木造薬師如来立像。平安末期に寄木造りの技法で作られた均整のとれた柔和な姿は仏像美術のうえからも高く評価されています。
観音堂,〒029-1111　岩手県一関市千厩町奥玉字林沢地内観光,すべての基本情報を見る
舘山公園,〒029-0803　岩手県一関市千厩町千厩館山地内観光,舘山公園は町が一望できる高台にあり、市民の憩いの場。サクラの開花時期になるとソメイヨシノ・シダレザクラ・八重桜が咲き乱れお花見を楽しむことができます。
千厩酒のくら交流施設（旧横屋酒造・佐藤家住宅）,〒029-0803　岩手県一関市千厩町千厩字北方134番地観光,明治から大正期に建てられたモダンな蔵群は、吹きガラスやイタリアスタイルなどの洋風材と白壁、土蔵造りなどの和風建築が見事に調和しています。敷地内には「馬事資料館」もあり、先人たちが馬と一緒に生きた証の馬具等が展示されています。
&lsquo;º?ã&permil;Æ?Z&lsquo;î,§029-0802 @&Scaron;â&#x17D;è&OElig;§&circ;ê&Scaron;Ö&#x17D;s?ç&permil;X&rsquo;¬?¬&mdash;&oelig;&#x17D;&scaron;&bull;s&ldquo;®&rsquo;n&ldquo;à&Scaron;Ï&OElig;õ,&OElig;§&#x17D;w&rsquo;è&mdash;L&OElig;`&bull;¶&permil;»?à&sbquo;Å A?]&OElig;Ë&ndash;&ndash;&Scaron;ú&sbquo;É&OElig;&scaron;&rsquo;z&sbquo;³&sbquo;ê&sbquo;½&Scaron;?&bull;&tilde;&sbquo;«&permil;®?ª&sbquo;Ì&OElig;Ã&ndash;¯&permil;Æ B&ldquo;y&Scaron;Ô A&circ;Í&tilde;F&mdash;  A&ldquo;y&bull;Ç&sbquo;È&sbquo;Ç&ndash;¯&permil;Æ&sbquo;Ì&bull;é&sbquo;ç&sbquo;µ&sbquo;â&OElig;&scaron;&rsquo;z&#x17D;j&sbquo;ð&rsquo;m&sbquo;é&sbquo;¤&sbquo;¦&sbquo;Å&lsaquo;M?d&sbquo;È&bull;¶&permil;»?à&sbquo;Å&sbquo;· B y&mdash;v&mdash;\&ndash;ñ z
室根山,〒029-1111　岩手県一関市千厩町/大東町/室根町観光,ツツジの群落と広い展望が魅力。国民休養地また県立自然公園に指定。ハンググライダ-のメッカで土日曜日にはその雄姿が見られる。
館ケ森ファームマーケット,〒029-3311　岩手県一関市藤沢町黄海字衣井沢山9-18観光,隣接するアーク牧場をはじめ地場の新鮮な農畜産物が買えるマーケット。
陶芸センター,〒029-3311　岩手県一関市藤沢町黄海字東深萱192-6観光,藤沢焼陶工より陶器づくりの製作指導がうけられる。
大籠キリシタン資料館,〒029-3522　岩手県一関市藤沢町大籠字右名沢28-7観光,徳川幕府のキリシタン迫害による、大籠キリシタンの歴史資料を展示。
ニコニコパーク,〒029-3521　岩手県東磐井郡藤沢町徳田観光,すべての基本情報を見る
ニコニコパーク,〒029-3404　岩手県一関市藤沢町徳田字大望沢観光,健康スポーツ公園
保呂羽山神社,〒029-3521　岩手県一関市藤沢町保呂羽観光,往古より東山郷の総鎮守で女人禁制の名山。
大籠キリシタン史跡,〒029-3522　岩手県一関市藤沢町大籠観光,徳川幕府のキリシタン迫害による殉教の地
ガンボクエゴノキ,〒029-3522　岩手県一関市藤沢町大篭沢内11観光,昭和２０年学会末知の珍木としてガンボクエゴノキの和名で発表
保呂羽山,〒029-3521　岩手県一関市藤沢町保呂羽観光,頂上よりの眺望は、名峯室根と対峙し絶佳である。
芦東山記念館,〒029-0521　岩手県一関市大東町渋民字伊勢堂71-17観光,近代日本の刑法の原点「無刑録」の著者芦東山に関する資料を展示。周辺には、芦東山の生家や墓地、終焉の地などゆかりの地が10ケ所ほど点在し、室根山を眺めながら、気持の良い散策も楽しめます。また、定期的に、歴史・芸術など親しみあるテーマで特別展などを開催しており、世代を問わず楽しめる施設となっています。
アストロ・ロマン大東遊歩道,〒029-0711　岩手県一関市大東町大原字山口51-137観光,森林レクリエーションエリア「アストロ・ロマン大東」内を縦横にはしる林間の遊歩道
アストロ・ロマン大東フィールド・アスレチックコース,〒029-0711　岩手県一関市大東町大原字山口51-137観光,すべての基本情報を見る
アストロ・ロマン大東キャンプ場,〒029-0711　岩手県一関市大東町大原字山口51-137観光,室根山天文台・室根高原牧場等が近くにあり、三陸海岸まで３０分。
アストロ・ロマン大東,〒029-0711　岩手県一関市大東町大原字山口51-137観光,４月〜１１月／研修棟（５０名）・キャンプ場（２３サイト）・マウンテンバイクコース・遊歩道・オリエンテーリングコース・アスレチックコース・テニスコート（２面）ほか
観福寺,〒029-0431　岩手県一関市大東町猿沢観光,真言宗智山派に属し，１１９１年工藤祐経の長男，犬坊丸が建立し，円長法師を迎えて，開山とした。本尊は不動明王である。
曽慶熊野神社,〒029-0522　岩手県一関市大東町曽慶観光,大野東人の勧請と伝えられ，紀州熊野大権現の分霊を祀った社。岩手県指定文化財
興田神社,〒029-0602　岩手県一関市大東町鳥海小山41観光,県指定文化財「銅鰐口」「金銅製前立」所蔵。本殿の彫刻は秀逸。
東川院,〒029-0521　岩手県一関市大東町渋民小林35観光,県指定文化財「木造聖観音坐像」「十一面観音立像」所蔵
摺沢八幡神社,〒029-0523　岩手県一関市大東町摺沢観光,前九年の役に苦戦をした源頼義が山城の八幡宮を祈念し勝利を収めたので殿舎を造り祀ったと記されている。本殿は県指定文化財
箒榧,〒029-0431　岩手県一関市大東町猿沢観光,根元直径１．９ｍ，高さ２３ｍ，枝張り２１ｍ，岩手県最大
滑岩渓流,〒029-0711　岩手県一関市大東町大原観光,岩場を滑るように流れる清流
小黒滝,〒029-0602　岩手県一関市大東町鳥海観光,深山幽谷を思わせる秘境の大岩石を流れ落ちる滝
蓬莱山,〒029-0602　岩手県一関市大東町鳥海観光,県自然環境保全地域指定。初夏に咲くドウダンツツジなど蛇絞岩地帯特有の亜高山性の植生が分布している。
株式会社ジパング,〒029-4102　岩手県西磐井郡平泉町平泉字泉屋17-4,すべての基本情報を見る
ゴールドレンタ平泉,〒029-4102　岩手県西磐井郡平泉町志羅山45-2観光,すべての基本情報を見る
大文字キャンプ場,〒029-4101　岩手県西磐井郡平泉町長島字山田地内観光,樹々につつまれ、夜は空一面の天然プラネタリウム。
木工芸館「遊鵬」,〒029-4101　岩手県西磐井郡平泉町長島字深山95-741観光,木工芸室（４５人収容）、ビデオホール（５４人収容）
束稲山のツツジ,〒029-4101　岩手県西磐井郡平泉町/奥州市前沢区/一関市東山町観光,かつて藤原氏が桜１万本を植えて東山になぞらえた山は、今はツツジの名所。
毛越寺のアヤメ,〒029-4102　岩手県西磐井郡平泉町平泉字大沢58観光,毛越寺の庭園は、平安時代の作庭様式を遺し国の特別史跡、特別名勝に指定されている。花の寺としても知られ、アヤメは３万株。
束稲山,〒029-4102　岩手県西磐井郡平泉町/奥州市前沢区／一関市東山町観光,８月１６日には大文字まつりが行われる。平泉から車３０分。５月下旬つつじまつり。奥羽山系の山なみ，北上平野の眺望絶佳。
南岩手カントリークラブ,〒029-3102　岩手県一関市花泉町金沢字鹿伏14-2観光,すべての基本情報を見る
総合運動公園キャンプ場,〒029-3205　岩手県一関市花泉町花泉字伊勢沢22観光,多目的競技場・野球場・テニスコート・自然体験広場
花と泉の公園「れいなｄｅふろーれす」,〒029-3103　岩手県一関市花泉町老松字宮沢159番地1観光,"「れいなｄｅふろーれす」ベゴニア館と交流プラザからなっており、ベゴニア館は東北初の大型ベゴニア鑑賞温室でベゴニアの原種など200種・2,000鉢を展示している。交流プラザでは加工体験室など郷土料理レストラン・喫茶コーナー等，観て・触れて・味わうなど五感で楽しめる体験型交流施設になっている。"
国見平温泉　はごろもの湯,〒029-4305　岩手県奥州市衣川区長袋230-5観光,ナトリウム塩化物強塩泉。サウナ、露天風呂もあり入浴後は和室、休憩室でゆっくりお休みいただけます。お昼にはぜひ温かい「国見ラーメン」をどうぞ。
黒滝温泉 のぞみの湯,〒029-4491　岩手県奥州市衣川区上立沢112観光,電気風呂、サウナあり、ラドン含有日本一。近くには黒滝渓谷があり、イワナ、ヤマメの絶好の釣り場。※平成17年より間伐材などを資源にしたガス化発電で自然と共生する施設
歴史ふれあい館,〒029-4421　岩手県奥州市衣川区日向60-18観光,考古・安部一族・商業都市・衣川村史の４つのテーマに分け、迫力ある展示で歴史を紹介。
みちのく古都カントリークラブ,〒029-4475　岩手県奥州市衣川区中山87-5観光,すべての基本情報を見る
衣川ふるさと自然塾,〒029-4387　岩手県奥州市衣川区下大森109-3観光,自然体験学習、森づくり研修など継続的な研修施設を目指しています。そば打ちやソーセージ作り、たたき染め、イワナつかみ取り、イワナ釣りなどの体験ができます。また、旧大森分校で教師であった直木賞作家三好京三の資料を展示する三好京三記念室もあります（要事前予約、入場無料）。
とうほくニュージーランド村庭園,〒029-4421　岩手県奥州市衣川区日向59観光,名木、名石、池をあしらった日本庭園。
和我叡登挙神社・月山権現社,〒029-4452　岩手県奥州市衣川区川西観光,和我叡登挙神社は山頂の奇石をご神体とする磐神社同様の延喜式内奥州一百坐胆沢七社の１つでもあり最も古い神社であるが、嘉祥３年(850）同地に慈覚大師の開基による月山権現社が勧請され、共に安倍氏が尊崇したという。月山権現社は長治2年(1105)に藤原清衡によって再興され、中尊寺奥の院として大いに栄えたと伝えられる。
雲際寺,〒029-4401　岩手県奥州市衣川区張山60観光,嘉祥3年慈覚大師の開基とされ、文治3年源義経の北の方が京より随行した禅師頼然に中興させたと伝えられる。文治5年、義経・北の方が高舘で自害後、頼然はその位牌を当寺に安置して菩提を弔ったという。
接待館跡,〒029-4443　岩手県奥州市観光,吾妻鏡では義経最後の地、衣河の館かと記されている。藤原秀衡の母の居館で、平泉府の迎賓館であったとされるが、広大な屋敷跡から大量のかわらけが出土されたことがそれを物語っている。正面には、関山・中尊寺がある。
安倍館跡,〒029-4384　岩手県奥州市衣川区石神観光,安倍頼良（頼時）の祖父忠頼、父忠良、そして頼良の三代の居館であったが、頼良の代に衣川の東端部の通称川西、川東地区に移ったと伝えられる。またこの安倍館は東郭と西郭があり現在は西郭のみを安倍館と呼んでいるが、居住地区は東郭であり昭和初期まではその面影を留めていた。西郭の形状から舞鶴館とも呼ばれ、また両郭が北股川と南股川の合流点にあったことから落合館とも称された。
菊の滝,〒029-4317　岩手県奥州市観光,桜，紅葉が美しい。西岸に菊の花が咲き乱れる風景の見事さから滝の名が付けられた。　文治４年（1188）前後の頃、源義経と北の方が度々遊覧したと伝えられ、両者の歌も残されている。
衣の滝,〒029-4462　岩手県奥州市衣川区増沢観光,高さ、巾とも１５ｍの滝で、その主滝の下の二番滝の傍に藍色に水を湛えた岩穴があり「藍壺」といい慈覚大師が衣を藍染にしたとの伝説がある。
国見山,〒029-4462　岩手県奥州市衣川区長塚観光,衣川第二の高峰、北側に延暦の古道が通っており、紀古佐美軍（きのこさみぐん）もこの地点から胆沢全域のみならず、北上川以東の閉伊一帯、岩手山以北の仁佐体（にさたい）方面を眺望して作戦を練り、北股川の支流沿いに北上してから胆沢川扇状地との境の稜線の南側に営（たむろ）を設けることにしたと伝えられる。
瑞月　（前すぱおあご）,〒023-0403　岩手県奥州市胆沢区若柳字堰袋8-1観光,ナトリウム・炭酸水素塩・塩化物温泉・神経痛に効く
胆沢郷土資料館,〒023-0401　岩手県奥州市胆沢区南都田字加賀谷地1-1観光,角塚古墳からの出土埴輪や約３万年前の旧石器、胆沢地方の民具など郷土資料が見学できる。
つぶ沼キャンプ場,〒023-0403　岩手県奥州市胆沢区若柳字谷子沢1-106観光,つぶ沼のほとりにあるキャンプ場。
於呂閇志胆沢川神社,〒023-0403　岩手県奥州市胆沢区若柳字下堰袋観光,4月29日の例大祭では猿岩に咲くユキツバキを家に持ち帰り、田の水口に祀り稲作の豊かな実りを願う神事があります。
角塚古墳,〒023-0401　岩手県奥州市胆沢区南都田字塚田観光,埴輪を伴う前方後円墳としては日本最北端に位置し、国指定史跡となっている。
ユキツバキ,〒023-0001　岩手県奥州市胆沢区若柳,胆沢川流域のユキツバキ群落は岩手県の天然記念物に指定されている。
胆沢川渓谷,〒023-0403　岩手県奥州市胆沢区若柳観光,国道３９７号線焼石連峰ビーチラインからの新緑、紅葉が人気。
つぶ沼,〒023-0403　岩手県奥州市胆沢区若柳字谷子字1-606観光,周辺はピクニック、キャンプの好適地
JA産直センター　菜旬館,〒029-4211　岩手県奥州市前沢区駅東2-8-7観光,新鮮野菜・果物を各種取り揃え、また、厳選された前沢牛をお客様の好みや御予算に応じて御贈答用に全国発送もお受け致しております。
肉のちだきゅうアスティ店,〒029-4211　岩手県奥州市前沢区駅東2-8-1観光,お客様から「よろこばれる商品を」モットーに、ステーキ用から煮込み用まで厳選された前沢牛を取り揃えご予算に合わせてお客様にお応えいたしております。又、全国発送致しております。
前沢温泉「舞鶴の湯」,〒029-4205　岩手県奥州市前沢区字徳沢1番地45観光,四季折々の自然をみおろせる、大きな展望風呂が自慢です。他に電気風呂、水風呂、サウナ、休憩室等があり、地場産品の売店や前沢牛の牛丼を提供する食堂も人気です。
三沢初子の釈迦像,〒029-4208　岩手県奥州市前沢区字山下181 久成寺内観光,丈わずか5.3cmの小像であるが、伊達騒動に際し、藩主伊達綱宗公の側室三沢初子が三人の息子の安泰を願い3体建立したもののうち次男村和に与えた1体である。要予約。
高野長英母堂の墓,〒029-4208　岩手県奥州市前沢区字山下72番地霊桃寺内観光,高野長英の母の墓
お物見公園,〒029-4206　岩手県奥州市前沢区陣場観光,前沢城主の城跡、桜の名所
西岩寺,〒029-4207　岩手県奥州市前沢区字下小路84番地観光,五百羅漢（現存28体）。要予約。
霊桃寺,〒029-4208　岩手県奥州市前沢区字山下72番地観光,奥羽三十三番の十八番札所。十一面観世音(秘仏）安置。
白鳥舘遺跡,〒029-4205　岩手県奥州市前沢区字白鳥舘観光,世界遺産候補地「白鳥舘遺跡」は前九年合戦で源義家と戦った安倍頼時の八男・白鳥八郎則任の居城と伝えられています。平安時代から中世末期までおよそ600年にわたり北上川の要衝地として利用された遺跡です。
明後沢古瓦出土地,〒029-4201　岩手県奥州市前沢区古城字明後沢観光,平安時代初期の瓦が多数出土している。また岩手県の史跡に指定されている。
経塚山のつつじ,〒029-4203　岩手県奥州市前沢区生母字二子観光,経塚山頂上からは北上川の蛇行、胆沢扇状地、奥羽の山々が美しく見える。特に5月下旬のつつじ咲く頃は、つつじの赤と山の緑のコントラストがよりはえて美しい。
お物見公園の桜,〒029-4206　岩手県奥州市前沢区陣場観光,前沢町を眼下に北上川をへだてて束稲山を望む前沢城主の城跡。樹齢80年、約200本の桜並木の花爛漫の姿は素晴らしい。
みちのく城址温泉　萌えの湯,〒029-4505　岩手県胆沢郡金ケ崎町永栄上宿26番地3観光,すべての基本情報を見る
永岡温泉 夢の湯,〒029-4504　岩手県胆沢郡金ケ崎町永沢石持沢6-284観光,駒ケ岳東麓、ゆるやかに広がる丘陵地帯にある温泉。隣接してゴルフ場がある。
千貫石温泉 湯元東館,〒029-4503　岩手県胆沢郡金ケ崎町西根二枚橋5-1観光,千貫石堤の畔りで風光明媚
岩手県立県南青少年の家,〒029-4504　岩手県胆沢郡金ケ崎町永沢下舘49-1観光,すべての基本情報を見る
岩手県立花きセンター,〒029-4501　岩手県胆沢郡金ケ崎町六原頭無2-1観光,すべての基本情報を見る
桑島重三郎記念館,〒029-4501　岩手県胆沢郡金ケ崎町六原下小路23-3観光,六原開拓の祖，桑島重三郎の遺品を展示。
金ヶ崎ゴルフコース,〒029-4504　岩手県胆沢郡金ケ崎町永沢観光,胆沢平野の丘陵地に広がるアーノルド・パーマー設置の戦略性の高い18ホール。クラブハウス内にはロッジを完備し泊りがけのゴルフに最適です。
千貫石森林公園キャンプ場,〒029-4503　岩手県胆沢郡金ケ崎町西根後千貫石15-1　キャンプ場バンガロー連絡事務所観光,自然と親しむことができる森林公園の中にあり，キャンプファイヤーOKのキャンプ場。
森山総合公園,〒029-4503　岩手県胆沢郡金ケ崎町西根森山31-2観光,すべての基本情報を見る
佐藤得二文学碑,〒029-4503　岩手県胆沢郡金ケ崎町西根南羽沢55観光,昭和３８年７月，小説「女のいくさ」で第３９回直木賞を受賞。
千田正記念館,〒029-4502　岩手県胆沢郡金ケ崎町三ケ尻谷地中98観光,衆議院議員３期，岩手県知事４期勤めた千田正の生家と木蔵及び旧知事公舎応接室を保存し，遺品を展示している。
千貫石森林公園,〒029-4503　岩手県胆沢郡金ケ崎町西根後千貫石15-1　キャンプ場バンガロー連絡事務所観光,自然と親しむことが出来る公園です。四季折々、個性あふれる景色が楽しめます。
諏訪公園,〒029-4503　岩手県胆沢郡金ケ崎町西根諏訪小路観光,北上川を見渡す高台にあり，周辺には，江戸時代のたたずまいが残っている。
伊達・南部藩境塚,〒029-4503　岩手県胆沢郡金ケ崎町西根遠谷巾1-15観光,伊達領，南部領の藩境を示す境場で駒ケ岳から釜石市唐丹まで，約１３０ｋｍにわたって塚が築かれている。
三角点展望台,〒029-4503　岩手県胆沢郡金ケ崎町西根和光観光,焼石連峰から胆沢平野まで３６０度の展望が楽しめる。
駒ヶ岳山麓,〒029-4503　岩手県胆沢郡金ケ崎町西根和光観光,約２．０００ｈａにおよぶ牧草地帯で，北海道やヨーロッパを思わせる景観を楽しめる。
千貫石堤,〒029-4503　岩手県胆沢郡金ケ崎町西根千貫石観光,金ケ崎の水田を潤し、また奥羽山系の四季折々の美しさをより楽しめるいこいの地として親しまれている。
駒ヶ岳,〒029-4503　岩手県胆沢郡金ケ崎町西根観光,金ケ崎町コースは、うがい清水のある赤鳥居をくぐってスタート。途中「下賽の河原」「上賽の河原」を通過し、駒ケ岳神社奥宮のある頂上を目指します。
