岩手町彫刻公園,〒028-4395　岩手県岩手郡岩手町五日市10-44観光,町特産の黒御影石を素材に、国内はもとより諸外国から優れた作家を招き、30回（S47〜H15）に渡って、岩手町国際石彫シンポジウムを開催しました。回を重ねるごとに内容も充実し、そこで制作された作品は、岩手町彫刻公園を中心に設置されています、黒御影石の持つ重厚な色合い、その時々でいろいろな表情を見せる作品、そのエネルギーをたっぷり感じて下さい。
くずまきワイン(葛巻高原食品加工株式会社),〒028-5403　岩手県岩手郡葛巻町江刈1-95-55観光,特産の山ぶどうを使用し、フルーティーな香りと切れのある味が人気のくずまきワインの製造工場。工場見学も可能(無料)。
森の館ウッディ・炭の科学館,〒028-5403　岩手県岩手郡葛巻町江刈1-95-55 くずまきワイン観光,森の館ウッディは、くずまきワインの直売所で、全てのワインやジュースが試飲可能です。
くずまき高原牧場,〒028-5402　岩手県岩手郡葛巻町葛巻40-57-176観光,牧場産の乳製品やパン・チーズが購入できるほか、様々な酪農体験が可能。
花工房　らら倶楽部,〒020-0585　岩手県岩手郡雫石町長山七ツ田27観光,東北一の広さを誇る花の直売所。隣接するレストラン「農家レストランらら」では、地元の素材を活かしたランチ、バイキングを提供。
玄武温泉,〒020-0585　岩手県岩手郡雫石町観光,玄武温泉（こそでやまの湯）は、太古の息吹が聞こえてくるような「玄武洞」へ向かう県道沿いの、葛根田渓流に面した、涼感あふれる静かな温泉です。（平成13年６月末に再掘削された新湯）　レジャースポットいっぱいの岩手山南麓エリアへの中継点となる絶好のロケーションにあり、スキー・ドライブ・釣り・紅葉狩りなどを楽しむアウトドア派に人気です。
南網張ありね温泉,〒020-0585　岩手県岩手郡雫石町長山猫沢3-6観光,ぬくもり温泉の南，まさに大自然に包まれた「森の温泉」。散策路で森林浴を楽しんだ後の露天風呂は格別。
雫石高倉温泉,〒020-0584　岩手県岩手郡雫石町高倉温泉観光,南部片富士と呼称される秀峰岩手山を望む雫石プリンスホテルの南側に大露天風呂があり，ゴルフ，スキーのスポーツレジャーのあとにゆったりと温泉に浸り，リフレッシュ。
国見温泉,〒020-0582　岩手県岩手郡雫石町橋湯国見温泉観光,駒ケ岳の南麓，秋田との県境にあり，初夏から秋まで駒ケ岳登山のベースキャンプとして多くの登山客でにぎわう温泉。含硫黄・ナトリウム・炭酸水素塩泉で，濃緑色。胃腸病，神経痛，皮フ病によく効くと言われ湯治客も多い。11月上旬〜５月中旬まで休業。自炊部・露天風呂あり。
滝ノ上温泉,〒020-0584　岩手県岩手郡雫石町西根観光,葛根田川上流にある。わずかに白く濁った湯が川岸から湧出している。山あいのひなびた風情がしみじみと味わえる秘湯。集まって流れおちる鳥越の滝の滝壷が手前にあり，また烏帽子岳・駒ヶ岳への登山基地となっている。
休暇村岩手網張温泉,〒020-0585　岩手県岩手郡雫石町網張温泉観光,休暇村岩手網張温泉は、豊かな自然とハイキングやスキーなど四季折々のレジャーが楽しめる岩手山の標高760ｍの高原に建っています。赤い屋根と白壁が木々の緑に映え、いかにも高原リゾートといったたたずまいが印象的。1300年の歴史を数え、昔から万病に効くと評判の温泉や、季節感あふれるお料理も楽しみです。
ありね山荘,〒020-0585　岩手県岩手郡雫石町長山小松倉13-7観光,平成12年に開館した日帰り入浴施設で湯は網張温泉からの分湯。吹き抜ける風までもがゆったりとした自然の中の素朴な山荘です。雄大な岩手山麓に位置する絶好のロケーションで、入浴しながら眼下に広がる雫石盆地の眺望は抜群。深呼吸すると甘い香りがしてきそうな乳白色のお湯は、体はもちろん心までも癒してくれます。
小岩井乳業工場,〒020-0507　岩手県岩手郡雫石町丸谷地36-1観光,みなさまの毎日の食卓にお届けしている「本物のおいしさ」は、ここ岩手県雫石町の小岩井工場で生まれています。宮沢賢治が「奇跡」と表現した美しい風景とともに、小岩井の牛乳やバターの製造過程を楽しんでみませんか？創業：1978年（昭和53年）
ケッパレランド,〒020-0573　岩手県岩手郡雫石町南畑第21地割26-15観光,夏はクロスカントリー、マウンテンバイク、ウォータージャンプなど、冬はクロスカントリースキーができる県内初のクロスカントリースキー場。芝ジブパーク、トランポリン、ミニランプ、スラックラインなどの1コインアメニティも充実。鶯宿温泉までをつなぐ登山道が整備されており、男助山登山の入り口としても。
八幡平カントリークラブ,〒020-0574　岩手県岩手郡雫石町鶯宿温泉観光,すべての基本情報を見る
雫石ゴルフ場,〒020-0593　岩手県岩手郡雫石町高倉温泉観光,すべての基本情報を見る
岩手県営屋内温水プール,〒020-0585　岩手県岩手郡雫石町長山大鉢森38-4観光,「ホットスイム雫石」の愛称で親しまれており，日水連公認の５０ｍプール（８コース）やウォータースライダーなどのファミリープールがある。
雫石あねっこ,〒020-0501　岩手県岩手郡雫石町観光,京美人の系統を引くと言われる雫石女性の“若い女性”をさす呼び名で，かすり着物姿で深いあみ笠をかぶっている。そのいでたちは雫石独特な風俗衣裳で「雫石あねっこ」スタイルといわれている。
御所湖乗りもの広場,〒020-0572　岩手県岩手郡雫石町西安庭11-7-4観光,サイクル列車ゴーカートをはじめ、変り種自転車やスワンサイクル、ローラー滑り台などユニークな乗り物が勢ぞろい。そばのファミリーランドとともに家族で楽しめるスポット。
岩手山神社,〒020-0585　岩手県岩手郡雫石町長山頭無野観光,坂上田村麻呂将軍が，岩手山にこもる赤頭の高丸を討伐のため，御陣小屋を設けられたところと伝えられており（南部叢書），通称お新山として参拝されている。例祭旧暦5月27日。
御所ダム,〒020-0501　岩手県岩手郡雫石町/盛岡市観光,雫石川をせき止めて造られた多目的ダムで中央コアー型ロックフィル，コンクリート動式の複合ダム。洪水調節，用水供給，発電を行っている。日本版ＴＶＡで北上川流域五大ダムのフィナーレを飾る。
鳥越の滝,〒020-0501　岩手県岩手郡雫石町西根観光,滝ノ上温泉に近い葛根田渓谷上流部にある滝。落差約30ｍで道路から見下ろすことができる。川岸から湧出した温泉や蒸気が注ぎ、滝壷からは湯けむりが上がっている。冬季(11月下旬〜4月下旬)は車両通行止めのため、見学はできない。
千沼ヶ原,〒020-0501　岩手県岩手郡雫石町観光,"烏帽子岳東に展開する神秘的な湿原，高山植物の宝庫。湿原全体で1,000近くの池塘(ちとう)があることから「千沼ヶ原」と呼ばれている。滝ノ上温泉より3時間。駒ケ岳8合目から約3時間30分"
三ツ石山,〒020-0501　岩手県岩手郡雫石町/八幡平市観光,展望雄大，乾性高山植物の宝庫。網張温泉よりリフト利用で２時間３０分。滝ノ上温泉より上り２時間３０分，下り１時間４０分。
駒ヶ岳,〒020-0501　岩手県岩手郡雫石町/仙北市（秋田県）観光,岩手，秋田の県境，八幡平の最南端に位置し高山植物の宝庫として知られている。昭和45年，火口内の女岳が大噴火した。国見温泉より3時間10分。
亀磨神社,〒028-5711　岩手県二戸市金田一字長川41,当地の座敷わらしは、南北朝時代に6歳で亡くなった亀麿（かめまろ）が正体と伝えられています。亀麿神社は、その「座敷わらし」を祀る神社です。　　平成21年10月、大火災があった緑風荘（現在復興準備中です）の敷地にありながら、奇跡的にその影響をまったく受けず、被災を免れました。そんな亀麿神社には、その鮮やかな赤い鳥居の奥に逃げ込んだ座敷わらしの姿が目撃されています。　&nbsp;&nbsp;「座敷わらし」に出会うと幸せが訪れるといい伝えられ、これまで総理大臣を歴任された方、有名企業の創業者、作家、漫画家、ミュージシャンなど様々な分野の人たちに幸せを求めて訪れています。
九戸城跡,〒028-6101　岩手県二戸市福岡字城の内観光,奥州藤原氏時代には城が置かれたというが不詳。三戸城（青森県三戸郡三戸町）を本拠とする南部氏の一族に九戸氏があり、永禄１２年（１５６９）政実のとき、鹿角地方奪還の戦功によって二戸郡を領し、九戸村伊保内から移って入城したとされる。天正１９年（１５９１）政実は南部氏に背いて挙兵、豊臣秀吉の発した大軍に攻められて滅びる。九戸城はその後，南部信直が福岡城と改称して三戸城から移る。信直没後、嫡男利直が入城するが，盛岡城が完成して利直が移ったため，廃城となった。現在は三方を深い谷に面した地形に面影をとどめているのみである。◎九戸政実（１５３６-１５９１）南部氏の一族。戦国末期，宗家の信直と争い，豊臣秀吉の兵五万に居城九戸城を攻められ降伏、斬首された。
ヒメボタル観賞会,岩手県二戸市福岡字織詰地内観光,折爪岳山頂付近は、豊富な湧き水、ブナやナラの木があり、東北最大級といわれる「ヒメボタル」の生息地になっています。百万匹ともいわれるヒメボタルの瞬く光の乱舞は真夏の山を彩る自然のイルミネーションのようです。　　そんな幻想的な輝きを観賞する「ヒメボタル観賞会」を無料シャトルバスの運行し開催します。
馬仙峡,〒028-6103　岩手県二戸市石切所観光,清冽な馬淵川（まべちがわ）を挟んで男神岩・女神岩や大崩崖(おうほうがけ）などの雄大な景観は県北随一といわれる名所です。　 大きさ日本一の夫婦岩「男神岩（おがみいわ）」、「女神岩（めがみいわ）」が国道4号線を北上してくる皆様を二戸市の入口でお出迎えします。　　男神岩の上にある展望台からは二戸地域を一望でき、紅葉の見頃は10月中旬〜11月上旬です。
折爪岳,〒028-6101　岩手県二戸市福岡字織詰26観光,7月上旬〜中旬に開催されるヒメボタル観賞会(要予約※１）では、100万匹ともいわれる東北最大級のヒメボタルが観賞でき、瞬く乱舞は自然のイルミネーションのようで幻想的です。　　「山居湧水（さんきょゆうすい）」といわれる、大変珍しい山頂付近からの湧き水やブナの原生林が残り、多様な動植物の宝庫です。　　ビジターセンター（Tel0195-23-7599）や食堂、キャンプ場、オートキャンプ場、登山コースなど整備されております。
八重吉煎餅店,〒023-1113　岩手県奥州市江刺区中町3-12観光,昭和9年の創業以来、50年以上亀の子せんべいを作り続けている。
種山高原星座の森,〒023-1551　岩手県奥州市江刺区米里字大畑66-21観光,種山高原は北上山地の丘陵が緩やかに起伏する草原。付近からは奥羽山脈と北上平野、北は遠く岩手山や、早池峰山が望め、見事な眺望のなかでキャンプが楽しめる。
種山高原キャンプ場,〒023-1551　岩手県奥州市江刺区米里字大畑66-21観光,種山高原は北上山地の丘陵が緩やかに起伏する草原。付近からは、西に奥羽山脈と北上平野、北は遠く岩手山や早池峰山が望め、見事な眺望のなかでキャンピングが楽しめる。
駅レンタカー釜石営業所,〒026-0031　岩手県釜石市観光,釜石駅前トヨタレンタカー内
鉄の歴史館,〒026-0002　岩手県釜石市大平町3-12-7観光,釜石と鉄のかかわりや，鉄の過去と未来を見つめる「鉄の殿堂」。特に，円筒形の吹抜ドーム内には，釜石市の北西，橋野町青ノ木に残る橋野三番高炉を原寸大で復元し，現代オーディオビジュアル技術を駆使したユニークな演出を行っている。金属鋳造体験では、オリジナルのキーホルダーを作成できる。
駅前橋上市場　サン・フィッシュ釜石,〒026-0031　岩手県釜石市鈴子町2-1観光,釜石駅前に開設された新市場。新鮮な魚介類を中心とした生鮮食品店、飲食店等が多数営業し、市道をはさんだ「シープラザ釜石」との間が連絡通路で結ばれていて、さまざまな特産品等の買い物も楽しめるほか、店舗の外では毎日朝市が開催されている。
日中永遠和平の像,〒026-0002　岩手県釜石市大平町（大平公園内）観光,戦時中に中国から強制連行され死亡した中国人殉難者の霊を慰め、日中友好を誓う像。
釜石大観音,〒026-0002　岩手県釜石市大平町3-9-1観光,高さ48.5mの鉄筋コンクリート造りの観音像で、その腕に魚を抱いている。内部は13階に分かれ、本尊の魚籃観音や三十三観音、七福神胎内めぐりなどがあり、12階は展望台になっている。
橋野高炉跡,〒026-0411　岩手県釜石市橋野町観光,安政５年から翌６年にかけ大島高任の指導によって建設された、現存する日本最古の洋式高炉跡で，国の文化財に指定されている。昭和５９年４月３日に、アメリカ金属協会から歴史的遺産と認められ、「ヒストリカル・ランドマーク賞」を受賞した。現在、世界遺産登録にむけ取組が進められている。
釜石市郷土資料館,〒026-0031　岩手県釜石市鈴子町15-2観光,鉄のまち釜石の象徴といえる橋野高炉の模型をはじめ、指定文化財、写真、生活用具など約４千数百点を展示。人々の暮らし、自然、文化、災害など７つのテーマに添って分かりやすく解説している。展示品のほとんどが市民からの寄贈によるもの。
仙人峠,〒026-0055　岩手県釜石市甲子町大橋観光,春の新緑，秋の紅葉は特に美しい。宮沢賢治詩集「春の修羅II」に「峠」という作品が収められているが、仙人峠をさしたものとされている。その詩碑が仙人トンネル釜石口広場に、平成２年に設置されている。
気仙大工左官伝承館,〒029-2206　岩手県陸前高田市小友町茗荷1-237観光,全国にその名を馳せた「気仙大工」の伝統技術の技と心を結集した明治初期の民家を再現。母屋の囲炉裏の炎がやさしく出迎えてくれる。母屋，展示館，資料庫。神戸から分灯された、東日本大震災のモニュメント「希望の灯り」が灯り続けている。
清水の湧口,〒029-2201　岩手県陸前高田市矢作町字清水観光,いわての名水20選の一つに選ばれたのを契機に、市内外からこの水を求めてやって来る人が断えない。
道の駅　高田松原,〒029-2205　岩手県陸前高田市高田町字古川28-5観光,観光物産センター（タピック45）、イベント広場、体験学習室等けんか七夕の山車を飾り、スクリーンで疑似体験できる物産館が隣接
タイムズカーレンタル　一関駅前店,〒021-0882　岩手県一関市上大槻街5-35観光,すべての基本情報を見る
矢びつ温泉,〒021-0101　岩手県一関市厳美町字下り松65-2観光,慈覚大師が居住したとされる雄大な山王山を背にした自噴温泉で、ちょっと熱めのお湯が自慢。周囲を取り囲む瑞山の自然と、四季折々の風情が楽しめます。
真湯温泉,〒021-0101　岩手県一関市厳美町字真湯１観光,栗駒山の東北麓，磐井川上流の右岸に湧く温泉。須川温泉の“直し湯”といわれている。
須川温泉,〒021-0101　岩手県一関市厳美町祭畤山国有林観光,岩手，秋田，宮城の３県にまたがる栗駒山の北側８合目（標高１２００ｍ）の高地にあり，鳥海山，月山，駒ケ岳などの山々を一望のもとに見渡すことができる。宿の須川高原温泉は，旅館部のほか自炊部もあり，大浴場は東北でも有数の大きさ。登山道をすこし登ったところには，おいらん風呂と呼ばれる蒸し風呂の小屋が３つあり，噴気孔の上にムシロを敷いて横たわり，毛布やムシロをかぶって体を暖めるという独特の蒸し風呂である。胃腸病，婦人病，呼吸器病に特効がある。
厳美渓温泉,〒021-0101　岩手県一関市厳美町観光,名勝天然記念物で知られる厳美渓畔に湧出している。泉質はナトリウム塩化物温泉で，きりきず，やけど，慢性皮膚病などによい。四季折々の渓谷美を眺めながらゆったりといで湯を楽しめる。
真湯温泉センター,〒021-0101　岩手県一関市厳美町字真湯観光,すべての基本情報を見る
昭和湖,〒021-0101　岩手県一関市厳美町祭畤山国有林内観光,剣岳溶岩により東西に分断され，東側には名残ヶ原のお花畑が，西には須川温泉から須川湖にかけ火口湖跡と思われる窪地がある。
栗駒山（須川岳）,〒021-0101　岩手県一関市厳美町祭畤山国有林内観光,栗駒火山群の主峰，タテヤマリンドウの大群落と山頂からの展望がすばらしい。須川温泉から徒歩９０分。
まん十屋,〒028-0523　岩手県遠野市中央通り5-11観光,明治末に創業以来、現在４代目となる醪まんじゅう専門店。酒のほのかな香りとふんわりした口あたりが特徴の逸品。
遠野市観光案内所,〒028-0522　岩手県遠野市新穀町5-8観光,すべての基本情報を見る
伝承園,〒028-0555　岩手県遠野市土淵町土淵6-5-1観光,"遠野の民俗資料の保護、むかしから伝わる技術や行事の伝承のための施設。園内には佐々木喜善記念館、1,000体のオシラサマを祭る土蔵造の「御蚕神堂」、民芸・木工品の製作実演ができる工芸館などがある。また、一角に移築されている旧菊池家住宅は、遠野最古の曲り家で重要文化財に指定されている。江戸中期の建築といわれ、曲り家の発生過程を知る貴重な遺構である。"
遠野市立博物館,〒028-0515　岩手県遠野市東舘町3-9観光,遠野市物語の世界、遠野の自然とくらし、遠野の民俗等。シアターでは民話やマンガ家水木しげるが描く河童などのアニメが人気。
遠野物語碑,〒028-0501　岩手県遠野市遠野駅前観光,昭和４５年、遠野物語出版６５年を記念して遠野駅前に建てられた。碑文には，「此話はすべて遠野の人佐々木鏡石君より聞きたり……」の序文の一節が刻まれている。
鍋倉公園,〒028-0524　岩手県遠野市新町観光,サクラ、ツツジが美しい。
遠野郷八幡宮,〒028-0541　岩手県遠野市松崎町白岩23-19観光,遠野郷の総鎮守。９月１４日，１５日の例大祭では郷土芸能が集う。
福泉寺,〒028-0545　岩手県遠野市松崎町駒木7-57観光,１７ｍに及ぶ日本一の木造十一面観音像で有名。
鍋倉城址,〒028-0524　岩手県遠野市新町観光,平泉の藤原泰衡討伐に功をたてた阿曾沼広綱は、源頼朝より和賀郡遠野十三郷を与えられて関東から下向し、横田城（遠野市松崎町）を築いたといい、以後、４００年にわたり阿曾沼氏が治め、広郷が鍋倉山に居城を移した。次いで鍋倉城は遠野南部氏の居所となり、明治に至る。
南部曲り家（菊池家）,〒028-0555　岩手県遠野市土淵町土淵6-5-1観光,伝承園は佐々木喜善の著作や資料を展示する佐々木喜善記念館を中心として旧菊池家住宅（国指定の重要文化財）、工芸館などがある。
高清水高原,〒028-0501　岩手県遠野市松崎町観光,レンゲツツジの群落がある。
早池峰山,〒028-0501　岩手県遠野市（宮古市）観光,北上山系の主峰。宮沢賢治が愛した。ハヤチネウスユキソウ等高山植物が豊富。河原坊より３時間。
新山根温泉べっぴんの湯,〒028-8521　岩手県久慈市山根町下戸鎖4-5-1観光,長内渓流上流の静かな山あいにある温泉で，東北一のPH値を誇るべっぴんの湯。その名のとおり、湯上りはもうお肌がすべすべ。温泉を囲む美しい自然と懐かしさを感じさせる風景が、みなさんの心と体を優しく癒します。露天風呂、シャワー施設を増設しリニューアルオープンをしました。
もぐらんぴあ　まちなか水族館,〒028-0061　岩手県久慈市中央2-9（久慈駅前）観光,ＪＲ・三陸鉄道の久慈駅近くにあるミニ水族館。水中や水辺で生活する生き物を集めて飼育、展示しています。楽しい屋台、縁日コーナーもあります。地下水族科学館もぐらんぴあは被災により閉鎖。復旧作業中であるが、再開目途は立っていません。
久慈琥珀博物館,〒028-0071　岩手県久慈市小久慈町19-156-133観光,緑に満ちた静かな森の中にある博物館。この久慈琥珀博物館では、失われた太古の世界を閉じ込めた美しい自然のタイムカプセル「琥珀」の不思議な魅力を体感することができます。久慈市は琥珀の産出量国内一ですが、博物館の敷地内では琥珀採掘体験場もあり、
岩場海水プール,〒028-7801　岩手県久慈市侍浜町観光,天然の岩場を利用した海水プール。すぐ隣にはキャンプ場もあり、絶景の海岸美の中、夏の醍醐味を満喫することができます。また隣接する宿泊施設「侍の湯きのこ屋」では、絶景を眺めながら海の幸を楽しむこともできます。
北侍浜キャンプ場,〒028-7801　岩手県久慈市侍浜町観光,侍浜海岸は久慈市の北方，陸中海岸国立公園の最北端にあたる海岸で，南北１０ｋｍにわたって１００ｍを越す豪壮な断崖と海食棚が連なっている。国民宿舎の“北限閣”を基点に南北に約５ｋｍに及ぶ遊歩道が赤松林の中に作られ，見事な展望が楽しめる。北限閣の北５００ｍにはキャンプ場と岩場を利用した海水プールがある。
久慈海岸・つりがね洞,〒028-8111　岩手県久慈市長内町観光,北部陸中海岸の代表的な景勝地で、日本最古の地層を有する断崖と岩礁が続く海岸。大小さまざまの小島が浮かぶなかでも、ひときわ目をひく「つりがね洞」は、大きなほら穴があり、その天井から釣り鐘型の岩（明治２９年の大津波で破壊）がぶらさがっていたことから、この呼び名がついたといわれております。トンネルを挟んで反対側には奇岩「かぶと岩」も名物となっています。
北限の海女,〒028-8111　岩手県久慈市宇部町観光,小袖海岸は久慈港の東南方，玉ノ脇から小袖におけての海岸で，海食断崖と岩礁の景勝が連なる。小袖浜では海女によるウニの採集漁業が行われており，日本北限の海女として知られる。小袖集落は特に有名で，夏期には海女作業の実演を見ることもできる。
巽山公園,〒028-0056　岩手県久慈市中町1-48観光,市民の憩いの場。2011年春に複合遊具が完成し子供たちに大人気！桜の季節には夜間ライトアップされた美しい桜を楽しめます。
