荒川高原,〒028-0501　岩手県遠野市（宮古市）観光,遠野市郊外にある。初夏のシャクナゲの群落が壮観。　平成20年国の重要文化的景観に選定されました。
貞任高原,〒028-0501　岩手県遠野市土淵町観光,ミズバショウの群落がみごと。
薬師岳,〒028-0501　岩手県遠野市観光,早池峰山南方にそびえ山頂はハイマツとシャクナゲが群生する。
久慈琥珀,〒028-0071　岩手県久慈市小久慈町観光,琥珀は３千万〜１億年前の松柏科樹脂の化石。久慈は遠く奈良時代から琥珀を産している。また，幸運の石といって珍重され，アクセサリーに加工されている。琥珀博物館やみやげ物店で。
滝ダム湖遊覧船,〒028-0091　岩手県久慈市大川目町,長内川流域の下流に作られた滝ダムは、久慈湾を望める「海の見えるダム」。　ダム湖の周辺は比較的人の手が入らない自然豊かな渓流です。　普段はダムの上部から見下ろす湖面を遊覧船で観光できます。
タイムズカーレンタル　久慈店,〒028-0091　岩手県久慈市大川目町第1地割4-5,※ご予約・お問い合わせは八戸店へ
平庭高原パークゴルフ場＆スキー場,〒028-8605　岩手県久慈市山形町平庭高原観光,ファミリーで遊べるパークゴルフ場。スキー場を利用しているので、上級者には最適だ。冬は、スキー場。変化に富んだ１０コースが魅力。雪質もすばらしいパウダースノー。
舟渡海水浴場,〒028-0041　岩手県久慈市長内町観光,陸中海岸国立公園にも指定されている美しい久慈市の海岸にあって、唯一の海水浴場。波打ち際のすぐ近くまで車で行け、波も穏やかで家族連れも安心して夏の醍醐味である海水浴を楽しむことができます。
侍浜遊歩道,〒028-8030　岩手県久慈市侍浜町観光,陸中海岸国立公園の最北端にあたる海岸で，断崖と海食海岸の入りまじったすばらしい景観。
久慈渓流,〒028-0091　岩手県久慈市大川目町観光,国道281号線に沿って流れる久慈渓流は、久慈平庭県立自然公園指定されている自然豊かな観光スポット。川面に面した山腹は断崖となって落ち込み、変化に富んだ渓流の美しさを見せています。その代表格が「鏡岩」とくに春の新緑や秋の紅葉は見応え十分です。
三船十段記念館,〒028-0082　岩手県久慈市川貫5-20-230観光,柔道家の歴史にその名を残す三船久蔵は、久慈市出身。講道館最高位の十段につき、その功績を称え記念館が建てられました。「空気投げ」をあみ出したことはあまりにも有名。ここでは柔道をはじめ、将棋や書道など三船十段の生涯や業績を紹介しています。柔道場も併設され、そこでは子どもたちから大人までたくさんの人たちが元気に汗をかいています。
久慈の市日,〒028-0056　岩手県久慈市中町観光,３と８のつく日に市街地で開催される。　地元の海の幸、山の幸、手作りのお惣菜などが並ぶ市民の台所。
諏訪神社,〒028-0041　岩手県久慈市長内町35-98観光,源義経ゆかりの神社。平泉の戦いから逃れた源義経一行は久慈までたどりつき、ここから北海道へ渡るためにみなとを見てまわり手だてを考えていると、そこへ追手の畠山重忠があらわれた。心の中では義経を敬っていた重忠はあたらないようにと祈りながら、義経に向かって矢を放つ。すると、その矢は松の木にあたり、義経は無事北へ落ちのびることができた。畠山重忠は矢が義経にあたらなかったことを感謝して、その矢をご神体として祠を建てた。それが諏訪神社の始まりであるとの言い伝えがある。
久慈城址,〒028-0091　岩手県久慈市大川目町観光,累代久慈氏の居城。三段式の山城で，東方に久慈市街地を望むことができる。
赤浜展望台,〒028-0041　岩手県久慈市長内町観光,すべての基本情報を見る
長泉寺の大イチョウ,〒028-0021　岩手県久慈市門前長泉寺観光,樹齢千百余年，周囲１５ｍ，高さ３０ｍの巨木で，日本最大のものと言われる。枝の間に乳房状のコブが多くあり，この樹の下で合掌すると乳房の病が治り，乳の出が良くなる，という言い伝えがある。
侍浜海岸,〒028-0001　岩手県久慈市侍浜町観光,陸中海岸国立公園の最北部，磯釣りの好漁場。野営場・海水プール・遊歩道などの施設があり，夏の行楽に最適。
牛島,〒028-0001　岩手県久慈市侍浜町麦生観光,久慈湾口に浮ぶ，赤松におおわれた島。牛が寝そべった形に見える。
久慈渓流,〒028-0001　岩手県久慈市大川目町〜山形町観光,川に面した山腹が断崖となって落ち込み、峡谷をなし、水石群が発達した川は、動静の変化のある渓流美をなしています。なかでも高く大きく聳え立つ鏡岩、屏風岩の壮大な美しさは、圧巻です。また、アユなどの魚が豊富で、釣り人たちの穴場となっています。
遠島山,〒028-0001　岩手県久慈市（岩泉町・山形村）観光,北上山系北部最高峰。ヒメコマツの自生地。
久慈広域観光協議会事務局,〒028-0061　岩手県久慈市中央3-39 あさひビル２階観光,久慈広域（久慈市・洋野町・野田村・普代村）の観光案内、情報発信、宿泊施設紹介　等
北上ビューロ,〒024-0061　岩手県北上市大通り1-3-1 おでんせプラザぐろーぶ観光,主として地元及び県内の特産品やお土産を販売しています。お客様の立場に立った商品選びはもちろん、お客様からの要望にできるだけお応えし、店頭に商品を並べています。　北上のお土産は地場産品を心優しくお渡しすること。　当店では地方発送も失礼のないよう配慮し、お届しています。　冷凍北上コロッケはここでも購入できます。
北上観光物産館アクセス,〒024-0061　岩手県北上市大通り1-3-1 おでんせプラザぐろーぶ観光,北上駅西口から地下通路直結の販売店。産地特定農産物からお菓子、工芸品まで幅広い品揃え。季節に応じた旬の商品も取り扱っています。春には、山菜・アスパラ、秋には二子さといも、初冬には北上市成田産のふじりんご等を販売しています。　季節限定品に限らず、随時全国宅配サービスを行っております。是非、ご利用ください。
鬼翔平コース,岩手県北上市,北上の魅力を4時間でまわる「鬼翔平コース」　【　北上駅　】⇒【　カムイヘチリコホ　】⇒【　江釣子古墳群　】⇒【　鬼の館　】⇒【　入畑展望台・宮沢賢治碑　】⇒【　夏油温泉　】⇒【　北上駅　】　※行き先等は随時相談に応じます(4時間程度内)
鬼すむ誇りコース,岩手県北上市,タクシーを利用して北上市内の観光名所を巡るコースです。　【　北上駅　】⇒【　サトウハチロー記念館　】⇒【　陣ヶ丘(北上夜曲の碑)　】⇒【　鬼の館　】⇒【　北上駅　】　※行き先等は随時相談に応じます(2時間程度内)
タイムズカーレンタル　北上駅西口店,〒024-0061　岩手県北上市大通り1-3-26,すべての基本情報を見る
ニッポンレンタカー　北上駅前店,〒024-0061　岩手県北上市大通り1-1-16観光,すべての基本情報を見る
つなとり温泉,〒024-0331　岩手県北上市和賀町横川目3-17-2観光,日本三景の一つ松島を思わせる景観から「和賀の松島」と呼ばれ、和賀川沿いには綱取断層を見ることができます。その景色を眺めながらゆったりくつろげる露天風呂が自慢の温泉です。日帰り温泉施設です。
水神温泉,〒024-0322　岩手県北上市和賀町岩崎観光,北上の奥座敷・夏油高原温泉郷の表玄関にあたる温泉。泉質は単純泉。近くにはミズバショウの群生地水上牧野もあり、自然で溢れている。都会の喧騒から逃れてのんびり過ごしたい人にオススメです。
ふるさと体験館北上,〒024-0324　岩手県北上市和賀町山口23-24-5観光,親子、子供会で楽しめる、もちつき、川魚のつかみどりなど、体験学習に最適の施設です。　●各種研修会　　各種講演会、研修会、研究発表などに利用できるこの施設。各種資料、ビデオ、パソコン等からの資料提示できるプロジェクターを備え付けています。　●スポーツ合宿　　　スポーツ合宿にも最適なふるさと体験館。近くにテニスコート(全天候型4面)、グラウンドゴルフ場(24ホール常設)、市民スキー場(ロープ塔)、多目的広場などが整備されています。　●自然体験　　キャンプ、バーベキューや芋煮会などが野外でできる外、バードウォッチング、星座観察などにも最適です。　　学校の特別活動、クラブ活動、合宿、子供会行事等でご利用の場合は減免措置がありますのでご相談ください。
北上市文化交流センター　さくらホール,〒024-0084　岩手県北上市さくら通り2-1-1観光,平成15年11月にオープンした「さくらホール」は、定員1500名を超える大ホール、中ホール、小ホールに加え、大小さまざまな練習室、アトリエ、会議室などを備えています。また、ホール内に緑を取り入れ、敷地全体を公園に仕立てています。
北上市立博物館,〒024-0043　岩手県北上市立花14-59観光,市立公園展勝地内の「みちのく民俗村」に隣接した「北上市立博物館」は、館内を『歴史』『生物』『地層』と3つのブースに分けられています。『歴史』ブースでは、〜北上川とその流域に生きてきた人々〜題し、旧石器時代から現代までの資料を配列しています。『生物』ブースは、〜北上の自然〜をテーマに展示。『地層』ブースは、北上周辺でみられる岩石鉱物の他、ミズホクジラ等の化石を元に北上の地形変遷を辿っています。
日本現代詩歌文学館,〒024-8503　岩手県北上市本石町2-5-60観光,日本現代詩歌文学館は、詩、短歌、俳句、川柳など、明治以降の日本の詩歌資料を全国規模で総合的に収集保存、展示を行い、詩歌文学の振興を図ることを目的とした全国唯一の詩歌専門の総合文学館です。全国から訪れる来館者も多く、「言霊の館」として広く親しまれています。
北上市民ゴルフ場,〒024-0058　岩手県北上市下鬼柳４-１-９２観光,すべての基本情報を見る
北上市憩いの森,〒024-0041　岩手県北上市稲瀬町観光,展勝地生活環境保全林内にありキャンプ場のほか、木工体験館、アスレチック遊具、遊歩道などが施設内にある。　付近には展勝地公園・博物館・みちのく民俗村・サトウハチロー記念館などがある。
大堤キャンプ場,〒024-0051　岩手県北上市相去町高前檀観光,北上総合運動公園内にあるキャンプ場。カマド４基、水道有り。　キャンプ場の利用申し込みは不要です。芝生での火気使用は禁止です。また、用具の貸し出し等はしておりませんので、各自でご用意下さい。　※イベント等の興業や集会等は許可が必要ですので都市計画課までご連絡下さい
げとうパークゴルフ場,〒024-0322　岩手県北上市和賀町岩崎新田観光,夏油高原スキー場にある全36ホールのコースは、老若男女問わず誰でも楽しむことができます。ご利用の際はお問い合わせ下さい。
多聞院伊澤家住宅,〒024-0325　岩手県北上市和賀町岩沢,久那斗神社の別当(僧職の一つ)家。多聞院伊澤家はもともと里に住み着いた羽黒派の修験者で、悪霊や人に降りかかる災いを除き、人々の安穏を守る修験者として、里人らも期待される存在でした。　　建物は間口10間半奥行き５間の木造平屋建てで、寄棟造りの茅葺屋根です。内部は座敷・道場・中間・常住・寝室・庭・台所・厩などからなります。母屋の後方にある久那斗神社里宮には、十一面観音が祀ってあります。　　平成２年に国の重要文化財に指定されました。
北上夜曲の碑,〒024-0043　岩手県北上市立花,甘く切ない青春の愛唱歌「北上夜曲」は、戦中戦後の混乱の中、口から口へと密かに歌い継がれ、全国の歌声喫茶で大いに唄われました。　北上夜曲は、当時18歳の「菊地　規（きくち　のりみ）」が作詞、当時17歳の「安藤　睦夫（あんどう　むつお）」が作曲しました。　この歌碑は昭和49年に建立され、昭和57年に現在の場所（展勝地レストハウス南側）へ移転しました。　全国でも珍しいと言われている作者直筆による歌詞と五線譜が刻まれております。
聖塚（河野通信墳墓）,〒024-0041　岩手県北上市稲瀬町観光,時宗の開祖である一遍（1239〜1289年）の祖父、河野通信【こうのみちのぶ】（1156〜1223年）の墓といわれています。通信は源頼朝に使えた武将でしたが、承久の乱（1221年）に敗れて平泉に流されました。聖塚周辺の風景は、『一遍上人絵伝』に描かれた一遍が通信の墓参りをする場面に、とてもよく似ています。
九年橋せせらぎ公園,岩手県北上市北鬼柳30地割地内,岩手県が和賀川河川環境整備事業の一環として整備し、平成12年に開園した公園です。和賀川ふれあい広場の対岸（北側）に位置し、親水護岸、芝生広場、サイクリングロード等があります。市街地と隣り合せた緑のオアシスとして親しまれ、自然環境をベースとしたやすらぎ空間として市民の憩いの場として活用されています。
和賀川グリーンパーク,〒024-0071　岩手県北上市上江釣子,平成９年に開園し、江釣子地区の和賀川左岸（北側）に位置しテニスコート、多目的グランド、芝生広場、バーベキュー広場等があります。中でもテニスコートは平成11年のインターハイの主会場としても利用された施設で、小中学生から大人まで幅広い層の市民に活用されています。
北上総合運動公園,〒024-0051　岩手県北上市相去町高前檀27-36観光,北上市の南部に位置し、平成11年の全国高等学校体育大会（インターハイ）の主会場になった市民スポーツ施設の拠点で、第１種陸上競技場、総合体育館、多目的運動場、キャンプ場等の各種施設があります。また公園の中央には大きな堤があり、冬季には白鳥飛来地としても市民の憩いの場として親しまれています。
万蔵寺,〒024-0211　岩手県北上市口内町字金峰山44観光,平安時代の仏像を多く安置している。
鹿島神社宮殿,〒024-0056　岩手県北上市鬼柳町満屋観光,桁行（けたゆき／間口、家の長さ）74.2cm、梁間（はりま／奥行）66.6m、高さ199.9m。鹿島神社宮殿は、1966年（昭和41年）に県指定有形文化財に指定されました。寛永18年南部重直が鬼柳村八幡宮に宝殿として奉りました。
八天遺跡,〒024-0103　岩手県北上市更木町,"八天遺跡は開田に伴い発見された、北上川左岸に接する総面積約2haの縄文中期から後期（約3,500年前）の集落跡です。墓と思われる穴からは、土製の鼻５点、口２点、耳１点が発見されました。また、大形円形建物跡をはじめとする、多数の遺構が見つかりました。土製の耳・鼻・口は仮面の部品と考えられています。また、大形円形建物跡は最大時で直径17mほどあったものが、10回近い建て替えの結果、直径8mほどまで小さくなったと考えられています。これらの発見から、八天遺跡は縄文時代の研究において、重要な遺跡の一つとなっています"
天狗の岩,〒024-0322　岩手県北上市和賀町岩崎新田,天狗の岩は、日本最大の石灰華ドームで、高さ17.6ｍ、下底部の径約25ｍ、頂上部約7ｍの巨大ドームは湧き出た湯が沈着して形成されたものです。夏油温泉の上流にあり、昭和32年、国の特別天然記念物に指定されました。
成田一里塚,〒024-0003　岩手県北上市成田,慶長７年に江戸日本橋から１２８里の塚として築かれたもので、現在、奥州街道で残っている一里塚は、わずか20か所と言われている。　この一里塚は盛岡まで10里の地点にあり、南一里目にある二子一里塚とともに、原形のまま残っているのは、全国でもここだけと言われている。
カムイヘチリコホ,〒024-0072　岩手県北上市北鬼柳,江釣子の語源であると言われているアイヌ語で「神々の遊び場」の意味を持つ。古墳をイメージした石の造形が神秘的な太古のロマンへいざないます。
国見山廃寺跡,〒024-0041　岩手県北上市稲瀬町内門岡,"北上市稲瀬町内門岡地区に建てられた、今から1,000年以上前の平安時代中頃に栄えた山岳寺院で、お堂や塔の跡が確認されています。　　伝承によれば、700を超える堂塔、36の僧坊をもつ大寺院であったといいます。また「定額寺【じょうがくじ】（国営の寺に準ずる位置付けの私営の寺）」として歴史書にみえる「陸奥国の極楽寺」ではないかとも考えられています。国見山廃寺は、北上川の東岸沿いにいくつも確認されている平安時代の寺院跡のひとつです。平泉が繁栄を迎える200年以上前に栄えた、北上盆地の中心的な寺院だったとみられます。"
江釣子古墳群,〒024-0071　岩手県北上市上江釣子観光,江釣子古墳群は和賀川北岸に分布する、五条丸・猫谷地・八幡・長沼の各古墳群の総称です。昭和26年に初めて発掘調査が行われ、北東北の古墳群の調査の先駆けとなりました。これらの古墳は７世紀後半から８世紀前半にかけて造られたもので、直径６〜15ｍの円墳が約120基以上あり、勾玉(まがたま)、切子玉（きりこだま）、蕨手刀（わらびてとう）、直刀、馬具などが数多く出土しています。
二子一里塚,〒024-0104　岩手県北上市二子町観光,慶長７年に江戸日本橋から１２８里の塚として築かれたもので、現在、奥州街道で残っている一里塚は、わずか20か所と言われている。　この一里塚は盛岡まで11里の地点にあり、北一里目にある成田一里塚とともに、原形のまま残っているのは、全国でもここだけと言われている。
樺山歴史の広場,〒024-0041　岩手県北上市稲瀬町観光,昭和26年の発掘調査で発見された遺跡は、立石をともなう石組の配石遺構（ストーンサークル）が注目を集め、国の指定史跡になっています。樺山遺跡は立石をもたないものを含めて約30ヶ所の配石遺構があり、縄文時代の集落跡と見られます。竪穴式住居も復元され、史跡公園として親しまれています。
藩境塚,〒024-0051　岩手県北上市相去町観光,南部領と伊達領との境界をあらわすため、1642（寛永19）年に築かれました。奥羽山脈の駒ヶ岳頂上から東に延び、釜石市の唐丹（とうに）湾まで続いています。　　　塚は大塚と小塚とからなり、小塚は大塚の間を埋めるように築かれました。北上川の西側では、和賀町岩崎地区、上鬼柳地区（旧南部領）と、相去町の三十人町地区・成沢地区・滝の沢地区（旧伊達領）との境界線上に残されています。北上川の東側では、立花地区（旧南部領）と、稲瀬町地区、口内町地区（旧伊達領）との境界線上に残されています。
飛勢城趾,〒024-0104　岩手県北上市二子町観光,奥州仕置で滅亡した和賀氏の居城跡であり、現在は八幡神社と公園になっています。　堀、石段が残り、北上川や奥羽の連山を一望に収めることができます。
岩崎城址,〒024-0321　岩手県北上市和賀町岩崎観光,岩崎城跡にあった旧岩崎公民館は、3.11の震災被害により、取り壊され現在は、「岩崎城址舞楽殿」となっています。旧岩崎公民館で展示していた資料の一部については、埋蔵文化財センター、博物館及び新岩崎地区交流センターで保管しています。■□■□■□■□■□■□■□■□■□■□■□■□■□■□■□■□■□■□岩崎城は和賀氏（中世の豪族）が最後に籠った城で、和賀川と夏油川にはさまれた台地上にあります。岩崎城が作られた時期は、正確にはわかりませんが南北朝時代（1336年〜1392年）にはすでにあったと思われます。1592年（天正20年）には、豊臣秀吉の命令により南部氏によって破壊されました。1600年（慶長5年）、和賀忠親は旧領地を奪い返すため一揆を起こしますが失敗し、ここ岩崎城に籠もり南部勢と激戦になりましたが翌年4月、城はついに陥落しました。
秀衡街道,岩手県北上市,秀衡街道とは、陸奥国・平泉と出羽国・横手を結んでいた道のことで、この道は「中尊寺金色堂」で知られる奥州藤原氏の三代目・秀衡の時代に金の輸送に使われていました。このことから「黄金の道」とも称され、鷲之巣金山や畝倉山、明戸山などの金山跡が残されています。平泉〜北上〜西和賀〜横手のおよそ80kmある道の中でも、人馬の事故が絶えなかった難所、和賀の「仙人峠」に藤原秀衡が先祖の霊を仙人権現(現 久那斗神社)として鎮座したと伝えられています。久那斗神社の里宮が秀衡街道の東西で祀られており、東の里宮は、北上市和賀町岩沢の多聞院伊澤家（国指定重要文化財）の久那斗神社、西の里宮は、横手市山内筏の筏隊山神社（筏の仙人様）です。両里宮には、奥州藤原氏のシンボルである「中尊寺ハス」が株分けされています。神木、樹齢約900年の「姥杉」は峠を越える目印となり行き交う人々を見守ってきました。※「姥杉」は、「森の巨人たち百選」に選ばれています。
岩手大学工学部附属金型技術研究センター,〒024-0051　岩手県北上市相去町山田2-35観光,先端技術の研究開発と人材教育を行っています。研究開発は、主に地域企業との共同研究や自主研究、または地域企業と具体的商品開発を行っています。人材教育は、地域技術者への先端技術講義・技術講演会・最新の工作機械を使用しての実習などを行っています。また、岩手大学大学院金型鋳造工学専攻の学生に対する授業や実習も行っています。
北上市基盤技術支援センター,〒024-0051　岩手県北上市相去町山田2-35観光,北上地域のものづくり産業を支援する施設で、工業製品などの測定、試験、評価のための各種精密測定機器を備え、企業の皆様に利用していただいている施設です。 ≪主な利用施設≫(1)精密測定室----三次元測定機、真円度測定機、表面形状測定機、測定顕微鏡(2)環境試験室----恒温恒湿室、電子顕微鏡、デジタルスコープ、蛍光Ｘ線分析装置(3)CADセンター---CAD/CAMシステム(4)研修会議室----セミナーや研修会などに利用されています
